id,name,gtin,category,brand,rating
prod15800053,Don Julio 1942 Anejo Tequila 750 ml,67454500032,13500107,Don Julio,4.8701
prod5390019,Woodford Reserve Kentucky Straight Bourbon Whiskey (750 ml),8112800150,13500111,Woodford Reserve,4.8551
P03019607,"Red Bull Summer Juneberry Edition (8.4 fl. oz., 24 pk.)",,1504,Red Bull,4.75
P990346159,"BuzzBallz Biggies Tequila 'Rita Cocktail, 1.75 L",,14450285,BuzzBallz,4.4
prod20500349,"Eagle Rare 10 Year Kentucky Bourbon Whiskey, 750 ml",8800402134,13500111,Eagle Rare,4.8519
prod13600691,"Blanton's Single Barrel Bourbon, 750 ml",8024400203,13500111,Blanton's,4.8182
prod24810380,"Zipfizz Energy Multi-Vitamin Hydration Drink Mix, Pina Colada, 20 ct.",,16050273,Zipfizz,4.7669
prod3030098,"Grey Goose Vodka, 1.75 L",8048028000,13500109,Grey Goose,4.7297
prod26692665,"Member's Mark Kentucky Straight Bourbon Whiskey, 750 ml",19396813353,13500111,Member's Mark,4.1951
prod22990838,Member's Mark Old Vine Zinfandel 750 ml,7874205866,1250105,Member's Mark,4.4909
prod18290778,"Zipfizz Energy Multi-Vitamin Hydration Drink Mix, Orange Cream, 20 ct.",,16050273,Zipfizz,4.7669
prod22423648,"Zipfizz Energy Multi-Vitamin Hydration Drink Mix, Limon, 20 ct.",,16050273,Zipfizz ,4.879
prod22051663,The Macallan Double Cask 12 Year Old Whisky 750 ml,81206602159,13500111,The Macallan,4.6105
P990390731,"Starry Mini Cans Lemon Lime, 7.5 fl. oz., 30 pk.",,2080101,Starry,4.0
122733,"Zipfizz Energy Multi-Vitamin Hydration Drink Mix, Citrus, 20 ct. ",,16050273,Zipfizz,4.6909
157909,Aunt Bertie's Tea Concentrate 1 gal.,,1495,Aunt Bertie's,4.2335
prod27254410,"Don Julio 70th Anejo Tequila, 750 ml",67454500082,13500107,Don Julio,4.7806
prod3510092,"Don Julio Blanco Tequila, 750 ml",67454500000,13500107,Don Julio,4.6276
P990333194,"Jarritos Club Pack Variety Pack, 12.5 fl. oz., 24 pk.",9047823320,2080101,Jarritos,4.7941
prod21041377,Casamigos Blanco Tequila 750 ml,8308945000,13500107,Casamigos,4.8044
prod2280398,"Kahlua The Original Rum and Coffee Liqueur, 750 ml",8954012271,13500105,Kahlua,4.7245
P990345228,"5-hour ENERGY Shot, Mixed Sport, Preworkout, 1.93 fl. oz., 24 pk.",,1504,5-hour ENERGY,4.4286
prod5650038,"Modelo Negra Mexican Amber Lager Beer, 12 fl. oz. bottle, 12 pk.",8066095787,12520103,Modelo,4.6027
P03020187,"MiO Liquid Water Enhancer Variety Pack 1.62 fl. oz., 3 pk.",,1502,MiO,4.6857
prod13650104,Fireball Cinnamon Whiskey 1.75 L,8800400928,13500111,Fireball,4.9278
prod24661349,"Karma Probiotic Water Variety Pack 18 oz., 12 pk.",,1501,Karma,4.6982
prod13890432,"Coors Banquet Lager Beer, 12 fl. oz. can, 24 pk.",7199011600,1430115,Coors,4.6522
prod20191057,"Crown Royal Regal Apple Whisky, 1.75 L",8200077159,13500111,Crown Royal,4.6065
prod16140196,"Ketel One Vodka, 1.75 L",8515680368,13500109,Ketel One,4.6864
prod20202792,"TRUE orange Flavor Packets, 500 ct.",,1502,TRUE orange,4.6039
prod27150910,"Member's Mark Tequila Reposado, 750 ml",19396813354,13500107,Member's Mark,4.0625
P03023214,"Goslings Stormy Peach Ginger Beer 12 fl. oz. can, 24 pk.",,15940876,Goslings,4.4545
prod17310847,"Corona Extra Mexican Lager Beer, 12 fl. oz. can, 24 pk.",3354495015,12520103,Corona,4.5752
prod21080315,Hornitos Reposado Sauza Tequila 1.75 L,8068683505,13500107,Hornitos,4.5977
prod20141245,"Don Julio Anejo Tequila, 750 ml",67454500006,13500107,Don Julio,4.7202
prod7040210,"Jose Cuervo Especial Gold Tequila, 1.75 L",8200019298,13500107,Jose Cuervo,4.8403
P990350858,"Member's Mark Irish Cream Liqueur, 1.75 L",19396842215,13500105,Member's Mark,4.2949
prod20298504,Johnnie Walker Black Label Blended Scotch Whisky 1.75L,8807616317,13500111,Johnnie Walker,4.5206
prod20541792,Johnnie Walker Blue Label Blended Scotch Whisky (750 ml),8811007005,13500111,Johnnie Walker,4.7486
prod20202783,"True Lime Crystallized Lime Packets, 500 ct.",,1490,True Lime,4.8858
prod26910687,"Zing Zang Strawberry Margarita-Daiquiri Mix 32 fl. oz. bottle, 6 pk.",,15940876,Zing Zang,4.0667
prod18290776,"Zipfizz Energy Multi-Vitamin Hydration Drink Mix, Lemon Iced Tea, 20 ct.",,16050273,Zipfizz,4.7
prod26910688,"Zing Zang Sweet and Sour Mix 32 fl. oz. bottle, 6 pk.",,15940876,Zing Zang,4.5
prod20391501,Buchanan's 12 Year Old Blended Scotch Whisky (750 ml),8811095532,13500111,Buchanan's,4.7407
prod26692292,"Zing Zang Margarita Mix, 32 fl. oz. bottle, 6 pk.",,15940876,Zing Zang,4.6098
prod11390224,"Buffalo Trace Kentucky Straight Bourbon Whiskey, 750 ml",8024400923,13500111,Buffalo Trace,4.9242
prod1340857,"Bud Light Lager Beer, 12 fl. oz. can, 36 pk.",,1250111,Bud Light,4.7097
prod2380060,"Ocean Spray Cranberry Grape Juice Cocktail 15.2 fl. oz., 12 pk.",3120078825,1506,Ocean Spray,4.7178
prod25791990,"E.H. Taylor Jr. Small Batch Bourbon Whiskey, 750 ml",8800400549,13500111,E.H. Taylor,5.0
prod21423850,"Member's Mark Egg Nog, 1.75 L",7874225525,15940876,Member's Mark,4.0344
P990394151,"Seagram's Escapes Ready To Drink Variety Pack, 12 fl. oz. can, 24 pk.",7031001245,14450285,Seagram's Escapes,5.0
prod18080031,"Grand Marnier Liqueur Orange and Cognac, 750 ml",8811093103,13500105,Grand Marnier,4.8889
prod20361677,"Estrella Jalisco Mexican Lager Beer, 12 fl. oz. bottle, 24 pk.",1820098404,12520103,Estrella Jalisco,4.6646
P03013281,"SodaStream Bubly Drops 7 Flavor Variety Pack, 8 Fl Oz",,2080101,SodaStream,4.6923
PL984181245,"Fireball Square Party Bucket Whisky, 50 ml, 25 pk.",8800405996,13500111,Fireball,4.9
P990378283,"Jose Cuervo Dragon Fruit Lemonade Margarita Cocktail, 1.75 L",81884402659,15940876,Jose Cuervo,4.5625
prod26180183,Heaven Hill Bottled In Bond Straight Bourbon 750 ml,9674900242,13500111,Heaven Hill,4.6333
prod22630726,"Gran Centenario Resposado Tequila, 750 ml",81153801423,13500107,Gran Centenario,4.8462
PL984178148,"Baileys Chocolate Irish Cream Liqueur, 750 ml",8676770548,13500105,Baileys,4.6667
prod7040151,Disaronno Originale Liqueur 750 ml,5003701450,13500105,Disaronno,4.8553
prod17960424,Remy Martin 1738 Accord Royal Cognac 750 ml,8723600211,13500112,Remy Martin,4.7836
PL984165105,"Buchanan's Pineapple Scotch Whisky, 750 ml",8807618724,13500111,Buchanan's,4.5789
prod18150005,"Hennessy Privilege VSOP Cognac, 750 ml",8811015105,13500112,Hennessy,4.8333
P990388128,"Member's Mark Sparkling Wine, 1.5 L",19396844255,1250107,Member's Mark,4.7692
prod22524550,Cazadores Reposado Tequila 1.75 L,8048017000,13500107,Cazadores,4.8283
prod20302530,D'USSE Cognac 750 ml,8048000292,13500112,D'USSE,4.8
prod22620737,"1800 Reserva Silver Tequila, 1.75 L",81153801015,13500107,1800,4.9091
162521,"Ice Mountain 100% Natural Spring Water 1 L, 15 pk.",8304600518,1501,Ice Mountain,4.6812
prod11691309,Bombay Sapphire Dry Gin 1.75 L,8048030100,13500110,Bombay,4.5308
prod20200899,"Member's Mark Silver Rum, 1.75 L",19396801955,13500108,Member's Mark,4.6806
prod24441252,"Modelo Especial Modelito Mexican Lager Beer, 7 fl. oz. bottle, 24 pk.",3354400021,12520103,Modelo,4.6356
PL984100704,"Zing Zang Bloody Mary Mix 7.5 fl. oz. can, 24 pk.",,15940876,Zing Zang,4.5833
PL984169289,"Zing Zang Blazing Bloody Mary Mix 32 fl. oz. bottle, 6 pk.",,15940876,Zing Zang,4.4118
prod16450203,"Corona Familiar Mexican Lager Beer, 32 fl. oz. bottle, 12 pk.",8066095682,12520103,Corona,4.9872
P990329882,"Twangerz Lemon Lime Salt Shakers, 10 ct.",,15940876,Twangerz,5.0
prod21090916,Casamigos Reposado Tequila (750 ml),85672400621,13500107,Casamigos,4.7834
prod13470224,"Jarritos Pineapple Soda 12.5 fl. oz., 30 pk.",9047823210,2080101,Jarritos,4.9512
P990349866,"La Crema Sonoma County Sauvignon Blanc, 750 ml",4933100413,1250103,La Crema,4.5946
prod26170222,"Maestro Dobel Diamante Reposado Tequila, 750 ml",81153801203,13500107,Maestro Dobel,4.8605
prod23120230,Hornitos Sauza Tequila Plata 1.75 L,8068683534,13500107,Hornitos,4.5315
P990334415,"Member's Mark Irish Whiskey, 750 ml",19396828687,13500111,Member's Mark,4.4138
prod25171643,"Teremana Small Batch Reposado Tequila, 750 ml",85001564003,13500107,Teremana,4.5968
P990329880,"Twang Lime Beer Salt, 24 ct.",,15940876,"Twang Partners, LTD",5.0
PL984172541,"Zing Zang Margarita Mix 7.5 fl. oz. can, 24 pk.",,15940876,Zing Zang,4.3333
prod25150301,"Teremana Small Batch Blanco Tequila, 750 ml",85001564002,13500107,Teremana,4.6
prod20191054,"Espolon Blanco Tequila, 750 ml",72105970750,13500107,Espolon,4.8049
P990360663,"Goslings Finest Tonic Water, 7.5 fl. oz. can, 24 pk.",,15940876,Goslings,
P03018642,"Jumex Mango Nectar 11.3 fl. oz., 24 pk.",7640612180,1506,Jumex,4.9286
prod21064088,"Hibiki Japanese Harmony Suntory Whisky, 750 ml",8068693405,13500111,Hibiki,4.95
prod24652952,"Woodford Reserve Derby Straight Bourbon Whiskey, 1 L",8112802228,13500111,Woodford Reserve,4.8611
prod12860367,Stella Rosa Berry Semi-Sweet Red Wine 750 ml ,8787263222,1250101,Stella Rosa,4.6964
prod13630391,"Jarritos Mineragua Sparkling Water, 12.5 fl. oz., 30 pk.",9047823214,1501,Jarritos,4.9155
P990348661,"Fireball Whisky Holiday Wreath, 50 ml, 14 pk.",8800406906,13500111,Fireball,4.907
P990392713,"Member's Mark Spiked Seltzer Variety Pack, 12 fl. oz. can, 24 pk.",85266430243,14450285,Member's Mark,5.0
P990392712,"Member's Mark Hard Iced Tea, 12 fl. oz. can, 24 pk.",85266430249,14450285,Member's Mark,4.8333
PL984101064,"Pacifico Clara Mexican Lager Beer, 12 fl. oz. can, 24 pk.",3354400182,12520103,Pacifico Clara,4.7684
P990378615,"1800 The Ultimate Margarita Passionfruit Cocktail, 1.75 L",81884402491,15940876,1800,4.5357
prod3020238,Patron Reposado Tequila 750 ml,72173300015,13500107,Patron,4.7651
prod1340881,"Glenfiddich 12 Year Single Malt Scotch Whisky, 750 ml",8366410736,13500111,Glenfiddich,4.7692
PL984173647,"Don Julio Rosado Tequila, 750 ml",8807618795,13500107,Don Julio,4.9091
prod3240043,"Jack Daniel's Tennessee Honey Whiskey, 750 ml",8218400033,13500111,Jack Daniel's,4.5291
prod26030095,Baker’s Single Barrel 7 Year Bourbon 750 ml,8068601540,13500111,Baker’s,4.75
P990404337,"Country Time Variety Pack 19 oz., 3 pk.",,1502,Country Time,
prod26693339,400 Conejos Joven Espadín Mezcal (750 ml),81153801362,13500107,400 Conejos,3.8864
P990336877,"Member's Mark Anejo Tequila, 750 ml",19396828688,13500107,Member's Mark,4.4615
prod13470223,"Sidral Mundet Apple Soda, 11.16 fl. oz., 30 pk.",9047823213,2080101,Novamex,4.8667
prod11250369,Hennessy XO Cognac 750 ml,8811015305,13500112,Hennessy,5.0
prod10290167,"Crush Strawberry Soda 12 fl. oz., 12 pk.",7800001362,2080101,Crush,4.1316
prod21044189,"Remy Martin XO Cognac, 750 ml",8723600233,13500112,Remy Martin,4.9474
prod20934039,"Gran Centenario Plata Tequila, 750 ml",81153801413,13500107,Gran Centenario,4.9
prod11210012,Chivas Regal 12-Year-Old Blended Scotch Whisky 750 ml,8043240039,13500111,Chivas Regal,4.5248
P990346891,"PATRÓN CRISTALINO Tequila, 750 ml",72173300613,13500107,PATRÓN,4.0
prod17860022,"Christian Brothers VS Grape Brandy, 1.75 L",8603681547,13500112,Christian Brothers,4.8788
prod11570585,Buchanan's Special Reserve 18 Year Old Blended Scotch Whisky 750 ml,8811095534,13500111,Buchanan's,4.4211
P990385238,"Member's Mark Peach Vodka, 1 L",19396829458,13500109,Member's Mark,4.5556
prod27160437,"Tequila Ocho Plata Blanco Tequila, 750 ml",89862700130,13500107,Tequila Ocho,4.9286
prod13470222,"Jarritos Tamarind Soda, 12.5 fl. oz., 30 pk.",9047823209,2080101,Jarritos,4.5122
PL984181496,"On The Rocks Cosmopolitan Cocktail, 750 ml",8068600810,15940876,On The Rocks,4.475
prod740753,"Crush Grape, 12 oz., 12 pk.",7800001345,2080101,Crush,4.2625
prod9510239,"DeKuyper Triple Sec Liqueur, 750 ml",8068638140,13500105,DeKuyper,4.8571
PL984180174,"Bacardi Ocean Punch Ready to Serve Premium Rum Cocktail, 1.75 L",8048098913,15940876,Bacardi,3.4
prod25690945,"1800 Cristalino Tequila, 750 ml",81153801646,13500107,1800,5.0
prod17890606,"Jarritos Fruit Punch, 12.5 fl. oz., 30 pk.",9047823211,2080101,Jarritos,4.6667
prod1340644,"Oliver Winery Sweet Red Blend Wine, 750 ml",1258400007,1250101,Oliver Winery,4.65
P990330841,"Traveller Blended Whiskey, 750 ml",8800406006,13500111,Traveller,4.6275
P990360662,"Goslings Citrus Tonic Water, 7.5 fl. oz. can, 24 pk. ",,15940876,Goslings,
prod11320152,"Pendleton Canadian Whisky, 750 ml",81153801932,13500111,Pendleton,4.7556
prod17890609,"Sangria Senorial Beverage, 11.6 fl. oz., 30 pk.",9047823212,2080101,Novamex,4.875
prod27300309,"Smirnoff Spicy Tamarind Vodka, 750 ml",8200078353,13500109,Smirnoff,4.7127
prod3780016,"Budweiser Lager Beer, 12 fl. oz. bottle, 24 pk.",1820011349,1250111,Budweiser,4.7143
prod26060433,Widow Jane Aged 10 Years Bourbon 750 ml,85628200531,13500111,Widow Jane,4.8889
prod23603308,"Buffalo Trace Bourbon Cream Liqueur, 750 ml",8024400371,13500105,Buffalo Trace,4.908
P990378628,"Member's Mark Ready To Serve Mojito, 1.75 L",19396845128,15940876,Member's Mark,3.625
prod20062143,100 Anos Reposado Tequila 750 ml,8068683316,13500107,100 Anos,4.8571
P990404344,"Kool Aid Party Pack 19 oz., 3 pk.",,1502,Kool-Aid,
prod20541784,Corralejo Reposado Tequila (1.75 L),72081593051,13500107,Corralejo,4.7297
P990360661,"Goslings Tropical Tonic Water, 7.5 fl. oz. can, 24 pk.",,15940876,Goslings,
P990350458,"Ketel One Espresso Martini, 750 ml",8807618867,14450285,Ketel One,4.4706
prod20870007,Patron Anejo Tequila 750 ml,72173300001,13500107,Patron,4.7451
prod4511003,Carolans Irish Cream Liqueur 1.75 L,81084503006,13500105,Carolans,4.8246
prod25790845,"1792 Full Proof Bourbon, 750 ml",8066000115,13500111,1792,5.0
prod18440046,Hpnotiq Tropical Fruit Liqueur 750 ml,73604001106,13500105,Hpnotiq,4.5
P990391422,"Jim Beam Pineapple Bourbon Whiskey, 750 ml",8068600995,13500111,Jim Beam,4.75
prod26440204,"Don Julio Ultima Reserva Tequila, 750 ml",8807618549,13500107,Don Julio,5.0
prod17570217,"Miller High Life Lager Beer, 12 fl. oz. can, 30 pk.",3410001341,1430115,Miller ,4.5909
prod15120355,"Sazerac Rye Straight Rye Whiskey, 750 ml",8800413994,13500111,Sazerac,4.898
P990333165,"RumChata Pineapple Cream Liqueur, 750 ml",8500003765,13500105,RumChata,4.7547
prod20412889,"Cazadores Blanco Tequila, 750 ml",8048017202,13500107,Cazadores,4.5517
prod21042818,"Clase Azul Reposado Tequila, 750 ml",85001427509,13500107,Clase Azul,5.0
prod23190256,Jose Cuervo Especial Silver Tequila 1 L,81153801082,13500107,Jose Cuervo,4.0
prod4570084,Caravella Limoncello Originale Lemon Liqueur 750 ml,8066077605,13500105,Caravella,4.9286
P990390162,"Member's Mark Chocolate Mocha Cream Liqueur, 1 L",19396843135,13500105,Member's Mark,4.5
prod7670055,Johnnie Walker Red Label Blended Scotch Whisky 1.75 L,8807616316,13500111,Johnnie Walker,4.2977
prod23102663,Casamigos Anejo Tequila 750 ml,85672400601,13500107,Casamigos,4.9545
prod20062139,1800 Anejo Tequila (750 ml),81153801003,13500107,1800,4.8824
P990349589,"LALO Blanco Tequila, 750 ml",81104103001,13500107,LALO,4.8571
prod20071345,Bacardi Gold Rum 1.75 L,8048002520,13500108,Bacardi,4.5772
P990396167,"Member's Mark Coconut Rum, 1.75 L",19396845862,13500108,Member's Mark,4.6667
P990359889,"Stranahan's Blue Peak American Whiskey, 750 ml",81884402116,13500111,Stranahan's,4.5
prod20350719,"Espolon Reposado Tequila, 750 ml",72105970751,13500107,Espolon,4.9231
prod11210014,"Licor 43 Liqueur, 750 ml",2992911541,13500105,Licor 43,5.0
prod20294779,"Wheatley Vodka, 750 ml",8800401976,13500109,Wheatley,5.0
P990348421,"BuzzBallz Biggies Chili Mango Cocktail, 1.75 L",85109100618,14450285,BuzzBallz,1.0
prod10770162,"Courvoisier VS Cognac, 750 ml",8954012932,13500112,Courvoisier,4.7
P03026811,"Buchanan's 12 Year Old Blended Scotch Whisky, 1.75 L",8811095531,13500111,Buchanan's,4.7881
PL984176046,"Cutwater Margarita Variety Pack, 6.7 fl. oz. can, 12 pk.",81675102353,14450285,Cutwater,3.6
prod17510621,"Tincup American Whiskey, 750 ml",81153801187,13500111,Tincup,4.8182
prod1340989,"el Jimador Reposado Tequila, 1.75 L",74460704980,13500107,el Jimador,4.5479
prod9740096,"RumChata Rum Cream, 1.75 L",89035505113,13500108,RumChata,5.0
PL984175366,"RumChata Pumpkin Spice Cream Liqueuer, 750 ml",8500003577,13500108,RumChata,5.0
prod22450453,"Old Parr Deluxe 12 Year Old Blended Scotch Whisky, 750 ml",8807617464,13500111,Old Parr,4.7308
prod25690593,Patron Extra Anejo Tequila 750 ml,72173300307,13500107,Patron,4.0
prod21241397,"Martell Cognac France VS Single Distillery, 750 ml",8043240081,13500112,Martell,4.9091
prod13630156,"Milagro Silver Tequila, 750 ml",8366486891,13500107,Milagro,4.6
prod23170071,Buchanan's Master Blended Scotch Whisky 750 ml,8807617778,13500111,Buchanan's,5.0
prod26180300,Tres Generaciones Reposado Tequila 750 ml,8068683603,13500107,Tres Generaciones,4.8333
prod20201613,Piedra Azul Reposado Tequila 750 ml,8130800229,13500107,Piedra Azul,4.2857
prod23981707,"Milagro Reposado Tequila, 750 ml",8366486894,13500107,Milagro,5.0
prod17890608,"Jarritos Lime Soda, 12.5 fl. oz., 30 pk.",9047823215,2080101,Jarritos,3.6667
prod21050128,Jose Cuervo Reserva de la Familia 750 ml,81153801145,13500107,Jose Cuervo,5.0
prod20412949,Jose Cuervo Tradicional Reposado Tequila 750 ml,8396019045,13500107,Jose Cuervo,4.75
prod23122488,"Bushmills Black Bush Irish Whiskey, 750 ml",81153801621,13500111,Bushmills,4.5
P990349864,"Jose Cuervo Holiday Edition Mistletoe Margarita, 1.75 L",81884402810,14450285,Jose Cuervo,4.0
prod27160441,"Tequila Ocho Reposado Tequila, 750 ml",,13500107,Tequila Ocho,4.5
prod24642960,"Henry McKenna Single Barrel Whiskey, 750 ml",,13500111,Henry McKenna,5.0
prod26130064,Casa Maestri Reposado Tequila (750 ml),66318800033,13500107,Casa Maestri,4.8
prod9050104,"Member's Mark Assorted Cookie Tray, 84 ct.",22856600000,1580107,Member's Mark,4.6865
PL984176872,"Custom Cupcakes, 30 ct.",19396829039,7320117,,4.7445
116403,Sara Lee Restaurant Style White Hot Dog Buns 16 ct.,7294560163,1580105,Sara Lee,4.5623
prod17660159,King's Hawaiian Original Dinner Rolls 32 ct.,7343507066,1580105,King's Hawaiian,4.8355
116408,Sara Lee Restaurant Style White Hamburger Buns 16 ct.,7294560164,1580105,Sara Lee,4.6424
PL984150753,Custom Half Sheet Cake,19396829391,7320117,,4.5093
163882,"Duchess Honey Buns, 3 oz., 12 pk.",7095370120,15191088,Duchess,4.6859
prod9300349,"Member's Mark All Butter Sandwich Croissants, 12 ct.",22908800000,1580105,Member's Mark,4.6313
165378,"Otis Spunkmeyer Variety Pack Muffins, 4 oz., 15 pk.",9175215101,1580109,Otis Spunkmeyer,4.672
PL984150758,"Custom 10"" Double Layer Cake",19396829390,7320117,,4.405
prod20631012,"Entenmann's Little Bites Chocolate Chip Muffins, 1.65 oz., 20 pk.",7203001837,1580109,Entenmann's,4.7248
prod22971006,"Member's Mark White and Chocolate Cupcakes with Buttercream Icing, 30 ct.",22941200000,1580107,Member's Mark,4.6851
160952,"Mission Soft Flour Taco Tortillas, 40 ct.",,2610113,Mission,4.7256
prod22885709,"Hostess Donettes Variety Pack Donuts, Snack Size, 1.5 oz., 32 pk.",88810905010,15191088,Hostess,4.4749
prod22381230,"Member's Mark Yeast Dinner Rolls, 24 ct.",22932200000,1580105,Member's Mark,4.5796
prod22131870,"Member's Mark Cookies Variety Pack, 18 ct.",22923100000,1464,Member's Mark,4.5338
P990347290,"Member's Mark Breakfast Platter, Five Flavor Assortment, 40 ct.",25522400000,1580107,Member's Mark,4.1111
prod22971008,"Member's Mark Spring Celebration Cupcakes, 30 ct.",22941400000,8117,Member's Mark,4.6256
PL984177157,Custom Full Sheet Cake,19396829392,7320117,,4.4323
prod23280060,"belVita Blueberry Breakfast Biscuits, 4 biscuits per pack, 25 pk.",4400004084,1465,belVita,4.7167
prod20933343,"Mission Carb Balance Soft Taco Flour Tortillas, 16 ct.",,2610113,Mission,4.7915
prod22070871,"Entenmann's Little Bites Party Cake Muffins, 1.65 oz., 20 pk.",7203002208,15191088,Entenmann's,4.7308
prod19200403,"Sara Lee Original Artesano Bakery Bread 20 oz., 2 pk.",7294561243,1580105,Sara Lee,4.6381
P990336549,"Member's Mark Variety Pack Muffins, 9 ct.",25517100000,1580109,,4.4755
PL980189476,"Member's Mark White and Chocolate Cupcakes with Whipped Icing, 30 ct.",22941300000,8117,Member's Mark,4.6961
prod3360016,"Member's Mark All Butter Cocktail Croissants, 20 ct.",22908700000,1580105,Member's Mark,4.5655
prod13450298,"Member's Mark Chocolate Chunk Cookies, 18 ct.",22923200000,1580107,Member's Mark,4.5669
P03001740,"Hostess Variety Pack Danish, 2.75 oz., 24 pk.",88810925081,1580109,Hostess,4.1943
PL980431816,"Member's Mark Gourmet Cupcakes Variety Pack, 8 ct.",25489400000,8117,Member's Mark,4.4958
prod13201229,"Member's Mark French Baguette, 2 ct.",22861500000,1580105,Member's Mark,4.3887
P990342645,"Member's Mark Gourmet Brownie Tray, 24 ct.",25520200000,1580107,Member's Mark,4.2808
162404,"Mission 10"" Burrito Flour Tortillas, 40 ct.",,2610113,Mission,4.6847
162163,"Sara Lee Honey Wheat Bread 20 oz., 2 pk.",7294561159,1580105,Sara Lee,4.7795
prod2550149,"Bimbo Soft White Bread Family Pack 20 oz., 2 pk.",7432309151,1580105,Bimbo Bakery ,4.5985
prod19730051,"Member's Mark Blueberry Muffins, 6 ct.",22898400000,1580109,Member's Mark,4.4503
P03007439,"Uncle Wally's Variety Pack Muffins, 20 pk.",75931324175,15191088,Uncle Wally's,3.956
PL984164967,"Member's Mark Sliced Brioche Slider Buns, 24 ct.",25495900000,1580105,Member's Mark,4.7011
prod25261293,"Member's Mark Cinnamon Crunch Muffin, 6 ct.",22973700000,1580109,Member's Mark,4.5944
prod1900604,"Member's Mark 10"" Tres Leches Style Cake with Strawberry Filling",22830200000,8117,Member's Mark,4.3841
199533,"Mission 6"" Fajita Flour Tortillas, 40 ct.",7373107004,2610113,Mission,4.7106
P990349850,"Member's Mark 12"" Honeycrisp Apple Lattice Pie, 72 oz.",25523100000,1580107,Member's Mark,4.4706
PL984176980,Custom Two-Tier Cake,19396829123,7320117,,4.2565
prod19730053,"Member's Mark Double Chocolate Muffins, 6 ct.",22898500000,1580109,Member's Mark,4.7392
P990391838,"Member's Mark OATful Bites, 0.9 oz., 24 pk.",19396847503,1580109,Member's Mark,4.6909
prod22760040,Thomas' Plain Bagels 12 ct.,4812127706,1580109,Thomas',4.7469
prod24020034,"Member's Mark Petite Hoagie Rolls, White Bread 18 ct.",22216900000,1580105,Member's Mark,4.5124
prod13450302,"Member's Mark Mini Candy Cookies, 36 ct.",22862000000,1580107,Member's Mark,4.3047
P990388459,"Duchess Mini Powdered Sugar Donuts, 3 oz, 12 pk.",7095389133,15191088,DUCHESS,4.5588
prod16360169,"Ole Mexican Foods Xtreme Wellness High Fiber Low Carb Tortilla Wraps, 16 ct.",,2610113,Ole,4.7675
P990390262,"Member's Mark Lemon Raspberry Loaf Naturally Flavored, 31 oz.",25532200000,1580107,Member's Mark,3.1217
prod14510124,"Member's Mark Tart & Sweet Apple Turnover, 8 ct.",22866000000,1580107,Member's Mark,4.352
PL984181866,"Member's Mark Sourdough Bread Bowl, 23 oz.",25504700000,1580105,Member's Mark,4.3573
prod24632530,"Member's Mark Tuxedo Bar Cake with Chocolate Mousse, 39 oz.",22963800000,1580107,Member's Mark,4.7756
prod22270017,"Member's Mark Plain Sliced Bagels, 6 ct.",22926400000,1580109,Member's Mark,4.4459
prod18650006,"Member's Mark Regular Hoagie Rolls, White Bread 12 ct.",22213400000,1580105,Member's Mark,4.3969
P990331583,"La Banderita Carb Counter Zero Net Carbs Soft Taco, 16 ct.",,2610113,LA BANDERITA,4.7042
P990328665,"Member's Mark 3"" Fresh Fruit Topped New York Style Cheesecakes, 8 ct.",25512100000,8117,Member's Mark,4.7084
prod22270019,"Member's Mark Everything Sliced Bagels, 6 ct.",22926700000,1580109,Member's Mark,4.4704
PL980425015,"Member's Mark Sweet Fruit Topped Chantilly Cream Bar Cake, 46 oz.",22983800000,8117,Member's Mark ,4.735
prod23551039,"Entenmann's Little Bites Fudge Brownie Mini Muffins 1.95 oz., 20 pk.",7203001839,15191088,Entenmann's,4.6303
prod21023464,"La Banderita 9” Homestyle Soft Taco Flour Tortillas, 24 ct. ",,2610113,La Banderita,4.6875
prod20352502,"Member's Mark Banana Nut Muffins, 6 ct.",22898300000,1580109,Member's Mark,4.5077
prod25351501,"Member's Mark Seasonal Assorted Cookie Tray, 60 ct.",22974200000,1464,Member's Mark,4.0293
prod20933085,"Mission Super Soft White Corn Tortillas, 110 ct.",,2610113,Mission,4.4819
prod22261108,"Member's Mark Sliced Cinnamon Raisin Bagels, 6 ct.",22926500000,1580109,Member's Mark,4.4921
PL980422955,"Member's Mark Tiramisu Cake, 32 oz.",22982800000,8117,Member's Mark ,4.3761
P990403636,"Member's Mark Chocolate Cherry Bread, 18 oz.",25535400000,15940790,Member's Mark,4.25
prod26540132,"Member's Mark Carrot Bar Cake, 38 oz.",22978000000,8117,Member's Mark,4.52
prod25620559,"Member's Mark 10"" Key Lime Pie, 41 oz.",22975700000,1580107,Member's Mark,4.4988
prod25620850,"Member's Mark Danish Variety Pack, 4 ct.",22975600000,1580107,Member's Mark,4.1973
prod13201232,"Member's Mark Artisan Ciabatta Rolls, 8 ct.",22861600000,15940790,Member's Mark,4.2775
prod22261107,"Member's Mark Blueberry Sliced Bagels, 6 ct.",22926600000,1580109,Member's Mark,4.2847
102219,"Member's Mark Jumbo Hoagie Rolls, White Bread, 6 ct.",22184700000,1580105,Member's Mark,4.5946
prod23570088,"Hostess Cinnamon Streusel Coffee Cake, 1.44 oz., 32 pk.",88810911406,15191088,Hostess,4.6775
PL984177057,Sweet Celebration Half Sheet Cake,19396829280,16540333,,4.5262
PL984176845,"Shimmering Elegance Cupcakes, Gold, 30 ct.",19396829012,7330197,,4.8273
131274,"Sara Lee 100% Whole Wheat Bread 20 oz., 2 pk.",7294561143,1580105,Sara Lee,4.656
PL984176878,"Sweet Celebration Cupcakes, 30 ct.",19396829045,16540333,,4.7984
P990353019,"Member's Mark x Carlo's Bakery Colossal Candy-Filled Vanilla Cupcake, 5 lbs.",25525500000,8117,Member's Mark x Carlo's Bakery,2.9896
PL984176896,"Bluey Cupcakes, 30 ct.",19396829062,1137,,4.8185
P03016454,"La Banderita Carb Counter 4.5"" Street Taco Tortillas 26 ct.",,2610113,La Banderita,4.7342
PL984176951,"Sweet Celebration 10"" Double Layer Cake",19396829092,16540333,,4.6142
P990331603,"La Banderita White Corn Tortillas, 74.6 oz. ",,2610113,LA BANDERITA,4.2039
prod16330248,"La Banderita 10"" Burrito Flour Tortillas, 20 ct.",,2610113,La Banderita,4.6067
P990363273,"Member's Mark x Carlo's Bakery Colossal Chocolate Peanut Butter Cupcake, 4.37 lbs.",25529500000,8117,Member's Mark x Carlo's Bakery,3.332
prod25620827,"Member's Mark Cheese Danish, 4 ct.",22975400000,1580107,Member's Mark,4.1783
PL984176898,"Disney Princess Cupcakes, 30 ct.",19396829064,1984,,4.8562
PL984176889,"Shimmering Elegance Cupcakes, Silver, 30 ct.",19396829055,7330197,,4.8
