id,name,gtin,category,brand,rating
P990395182,"Member's Mark Caramel Cookie Clusters, 23.46 oz.",19396848462,690107,Member's Mark,4.7728
prod22130342,"M&M'S Peanut Milk Chocolate Candy, 62 oz.",4000053321,690107,M&M'S,4.7749
prod22130341,"M&M'S Milk Chocolate Candy, 62 oz.",4000053319,690107,M&M'S,4.7311
164323,"Ferrero Rocher Premium Milk Chocolate Hazelnut, 48 ct.",980012048,690107,Ferrero Rocher,4.8456
prod22452302,"M&M'S Peanut Butter Milk Chocolate Candy, 55 oz.",4000054183,690107,M&M'S,4.7863
prod22270173,"M&M's Milk Chocolate Patriotic Mix, 62 oz.",4000053463,690107,M&M's,4.6975
prod22270174,"M&M'S Milk Chocolate Peanut Red, White & Blue Bulk Candy, 62 oz.",4000053465,690107,M&M'S,4.7269
prod24372632,HERSHEY'S S'mores Kit,3400047926,690107,Hershey's,4.4875
P03000612,"Mars Milk Chocolate Variety Pack Candy, 145 pcs. ",4000057985,690107,Mars Variety,4.7465
182959,"HERSHEY'S Variety Pack, Milk Chocolate Candy, 30 pk.",3400040595,690107,Hershey's,4.7696
prod18380257,"Dum Dum Original Mix Pops, 500 pcs.",3080010049,16290834,Dum Dums,4.8158
prod25490484,"HERSHEY'S Variety Pack Chocolate Candy, Minis, 220 pcs.",3400066181,690107,Hershey's,4.7274
P03006722,"Life Savers Wint-O-Green Mints Hard Candy, 3 lbs.",2200029074,1457,Life Savers,4.8671
prod8510250,"Mars Chocolate Candy Bars, Variety Pack, Full Size, 30 pk.",4000048290,690107,Mars Variety,4.7324
prod23210767,"Member's Mark Starlight Mints, 7 lbs.",7874232715,1457,Member's Mark,4.8113
prod21351071,"Tootsie Playtime Mix Bag, 4.75 lbs.",7172000881,16290835,Tootsie Roll,4.6819
198768,"HERSHEY'S Miniatures Variety Pack Chocolate Candy, 180 pcs.",3400021542,690107,Hershey's,4.782
P990390593,"Members Mark Dark Chocolate Covered Roasted Pistachios, 22 oz.",19396847510,690107,Member's Mark,4.7164
158721,"Blow Pops Assorted Mix, 100 pcs.",1420033869,16290834,CHARMS,4.7924
119102,"AirHeads Variety Pack, 0.55 oz., 90 pk.",7339006711,16290835,Airheads,4.8089
160635,"REESE'S Milk Chocolate Peanut Butter Cups, 1.5 oz., 36 pk.",3400044000,690107,Reese's,4.7474
P03005589,"Nerds Gummy Clusters, Party Size, 32 oz.",7920006820,16290835,Nerds,4.8816
P03000324,"HERSHEY'S Assorted Chocolate Factory Favorites Snack Size Candy, 155 pcs.",3400099758,690107,Hershey's ,4.6667
prod25450708,"Starburst & Skittles Chewy Candy, Variety Box, Full Size, 30 pk.",2200002279,16290835,Mars Variety,4.789
P03002743,REESE'S Milk Chocolate Peanut Butter Eggs Easter Candy 65 pcs.,3400048237,690107,Reese's,4.7225
prod6290003,"HERSHEY'S NUGGETS Assorted Chocolate Candy, 145 pcs.",3400001661,690107,Hershey's,4.7918
P03006750,"Mars Fundraiser Variety Pack Candy Bars, Full Size, 52 pk.",4000058308,690107,Mars Variety,4.8187
159938,"Tootsie Pops Assorted Mix, 100 pcs.",,690107,Tootsie,4.8078
119101,"Airheads Xtremes, 2 oz., 18 pk.",7339000837,16290835,Airheads,4.8015
P990332235,"Skittles & Lifesavers Variety Pack, 100 pcs.",2200029717,16290835,Mars,4.7618
P03000309,"SOUR PATCH KIDS and SWEDISH FISH Candy, Fun Size, 200 pk.",7046200880,16290835,Sour Patch Kids,4.796
157752,"M&M'S Peanut Milk Chocolate Candy, Singles Size, 1.74 oz., 48 pk.",4000001232,690107,M&M'S,4.71
128353,"Dubble Bubble Bubble Gum, 380 pcs. ",5964236360,1457,Dubble Bubble,4.7745
198767,"HERSHEY'S KISSES Milk Chocolate Candy, 330 pcs.",3400012296,690107,Hershey's,4.8405
prod8150240,"Snickers Milk Chocolate Candy Bars, Full Size, 1.86 oz., 48 pk.",4000052431,690107,Snickers,4.7304
prod8650445,"HERSHEY'S Chocolate Lovers Candy Bars, Variety Pack, Full Size, 52 pk.",3400039981,690107,Hershey's,4.7282
P990330133,"EXTRA Mint Sugar Free Chewing Gum, Variety Pack, 15 pc., 18 pk.",2200029483,1457,EXTRA,4.7457
P990346153,"JOLLY RANCHER & TWIZZLERS Fruit Flavored Candy, Variety Pack, Fun Size, 270 pcs.",3400045659,16290835,Twizzlers and Jolly Rancher,4.5492
P03010458,"Lindt LINDOR Assorted Chocolate Candy Truffles, 19 oz.",954243998,690107,Lindt,4.8331
157448,"Skittles Original Fruity Chewy Candy, Full Size, 2.17 oz., 36 pk.",4000001160,16290835,Skittles,4.531
prod14100147,"Butterfinger Candy Bars, Full Size, 1.9 oz., 36 pk.",9990082020,690107,Butterfinger,4.6698
163663,"SOUR PATCH KIDS Soft & Chewy Candy, 2 oz., 24 pk.",7046201234,16290835,Sour Patch Kids,4.7744
159941,"KIT KAT Milk Chocolate Wafer Candy, Full Size, 1.5 oz., 36 pk.",3400024600,690107,Kit Kat,4.7462
prod1110481,"Twix Caramel Cookie Chocolate Candy Bars, Full Size, 1.79 oz., 36 pk.",4000035391,690107,Twix,4.7926
P990365361,"HERSHEY'S Easter Springtime Mix Chocolate Candy, Variety Pack, 125 pcs.",3400099727,690107,Hershey,4.7462
P990335877,"Member's Mark Milk Chocolate Almonds, 48 oz.",19396840968,690107,Member's Mark,4.7724
160631,"HERSHEY'S Milk Chocolate Candy Bars, 1.55 oz., 36 pk.",3400024000,690107,Hershey's,4.7242
P03001144,"Member's Mark Milk Chocolate Sea Salt Caramels, 36 oz.",7874210798,690107,Member's Mark,4.8362
P03002839,"Member's Mark Milk Chocolate Pecan Caramel Clusters, 30.2 oz.",19396831968,690107,Member's Mark,4.6496
159969,"M&M'S Milk Chocolate Candy, Full Size, 1.69 oz., 48 pk.",4000001231,690107,M&M'S,4.7072
163104,"Skittles Sour Fruity Chewy Candy, Full Size, 1.8 oz., 24 pk.",4000001266,16290835,Skittles,4.5318
prod20100147,"Ring Pop Variety Pack, 0.5 oz., 44 pk.",4111601189,16290834,Ring Pop,4.8004
155513,"JOLLY RANCHER Assorted Fruit Flavored Hard Candy, 5 lbs.",1070015680,16290834,Jolly Rancher,4.4126
prod25340184,"Nerds Gummy Clusters Candy, Share Size, 3 oz., 12 pk.",7920024905,16290835,Nerds,4.8632
prod23030856,"Member's Mark Dark Chocolate Thins with Almonds & Sea Salt, 20 oz.",7874221923,690107,Member's Mark,4.7634
prod18140238,"SOUR PUNCH Rainbow Straws, Chewy Candy, 2 oz., 24 ct. ",4136405792,16290835,Sour Punch,4.6575
prod22321595,"HERSHEY'S Milk Chocolate Bars, Snack Size, 80 pcs.",3400040407,690107,Hershey's,4.821
P03002757,"Starburst Original Assorted Jelly Beans, 54 oz.",2200029050,16290835,Starburst,4.5219
157382,"HERSHEY'S Milk Chocolate with Whole Almonds Candy Bars, Full Size, 1.45 oz., 36 pk.",3400024100,690107,Hershey's,4.724
P03019582,"UnReal Dark Chocolate Coconut Bars, Mini, 11.1 oz.",85748400671,690107,UnReal,4.6911
155983,"HERSHEY'S Cookies 'n' Creme Candy Bars, Full Size, 1.55 oz., 36 pk.",3400023900,690107,Hershey's,4.6729
P03019732,"Extra Spearmint Sugar Free Chewing Gum Bulk Pack 15 pcs., 10 pk.",2200015954,1457,EXTRA,4.7769
P03020740,"Orbit Mint Sugar Free Chewing Gum, Variety Pack, 14 pcs., 18 pk.",2200011437,1457,Orbit,4.6578
prod24450066,"SOUR PATCH KIDS & SWEDISH FISH Variety Pack Candy, 2 oz., 24 pk.",7046200656,16290835,Sour Patch Kids,4.7285
P03016680,"Member's Mark Dark Chocolate Soft Sea Salt Caramels, 36 oz.",19396833269,690107,Member's Mark,4.8128
P03004218,"Member's Mark Milk Chocolate Toffee Truffle with Sea Salt, 19 oz.",19396831951,690107,Member's Mark,4.7417
P990331029,"HARIBO Goldbears, 2 oz., 24 pk.",4223830188,16290835,HARIBO ,4.6458
P990335878,"Member's Mark Milk Chocolate Raisins, 54 oz.",19396840999,690107,Member's Mark,4.7693
156070,"Push Pop Variety Pack Candy, 0.5 oz., 24 ct.",4111600902,16290834,Topps,4.6863
P03016122,"REESE'S Chocolate Peanut Butter Dipped, Animal Crackers, 24 oz.",3400022932,690107,Reese's,4.7147
P990322917,"Member’s Mark Strawberry Yogurt Almonds, 17.5 oz.",4166807955,9520104,Member's Mark,4.5669
P990332254,"TWIZZLERS Strawberry Flavored Twists Tub, 5 lbs.",3400050302,16290835,TWIZZLERS,4.4399
P03019728,"Extra Polar Ice Sugar Free Chewing Gum, 15 pcs., 10 pk.",2200015953,1457,Extra,4.6807
prod24544046,"Werther's Original Hard Caramel Candy, 39.75 oz.",,16290834,Werther's,4.8905
127380,"BROOKSIDE Dark Chocolate Pomegranate Flavored Chocolate, 32 oz.",6843738920,690107,Brookside,4.828
P990349234,"Black Forest Gummy Bears, 4 lbs.",4142008094,16290835,Black Forest,4.2887
P03019727,"Extra Peppermint Sugar Free Chewing Gum, 15 pcs., 10 pk.",2200015952,1457,EXTRA,4.7376
176225,"Parade Cotton Candy, 2 oz., 8 pk.",1420030628,16290835,Parade,4.7496
prod9140507,"SOUR PATCH KIDS Watermelon Soft Chewy Candy, 2 oz., 24 pk.",7046201232,16290835,Sour Patch Kids,4.775
prod22740143,"Mentos Pure Fresh Mint, Sugar-Free Chewing Gum, 50 pcs., 4 pk.",7339001224,1457,Mentos,4.8178
P990348109,"Skittles Wild Berry Fruity Chewy Candy Full Size Bulk Pack 2.17 oz., 36 ct.",4000001162,16290835,SKITTLES,4.6185
prod21023652,"Bazooka Candy, Variety Pack, 40 ct.",4111624108,16290834,Ring Pop,4.8676
156002,"PAYDAY Peanut Caramel Candy, 1.85 oz., 24 pk.",1070096323,16290440,Payday,4.7948
prod22752528,"Skittles Original Chewy Candy Bulk Jar, 54 oz.",,16290835,Skittles,4.6358
P03006616,"Life Savers Pep-O-Mint Breath Mints, 3 lbs.",,1457,Life Savers,4.8253
prod22752530,"Starburst Original Fruity Chewy Candy, 54 oz.",,16290835,Starburst,4.6728
prod22452338,"SNICKERS Milk Chocolate Candy Bars, Fun Size, 70 pcs.",4000054466,690107,Snickers,4.8695
prod24451034,"Kinder Bueno Milk Chocolate Hazelnut Bars, 1.5 oz., 20 pk.",980055210,690107,Kinder Bueno,4.8134
P03020624,"REESE'S Milk Chocolate Peanut Butter Cups, Snack Size, 65 pcs.",,690107,Reese's,4.7255
prod25430285,"CADBURY CARAMELLO Milk Chocolate Caramel Candy, Minis, 27.6 oz. ",,690107,Cadbury,4.7771
prod24450073,"Flipz Milk Chocolate Covered Pretzels, 24 oz.",81021903080,16650640,Flipz,4.7185
118134,"Hubba Bubba Bubble Tape Gum, 2 oz., 12 pk.",2200001772,1457,Hubba Bubba,4.6577
prod20302272,"ICE BREAKERS Ice Cubes, Peppermint Sugar Free Chewing Gum, 40 pcs., 4 pk.",3400070025,1457,Ice Breakers,4.723
prod710492,"Red Vines Original Red Twists, 5 lbs.",,16290835,Red Vines,4.357
prod8150242,"Milky Way Chocolate Candy Bars, Full Size, 1.84 oz., 36 pk.",4000052206,690107,Milky Way,4.625
193847,"Mentos Fruit Variety, 1.32 oz., 15 pk.",,1457,Mentos,4.6239
160454,"Starburst Original Fruity Chewy Candy, Full Size, 2.07 oz., 36 ct.",4000001151,16290835,Starburst,4.6484
178235,"Baby Bottle Pop Variety Pack Candy, 0.85 oz., 20 ct.",4111610634,16290834,Topps,4.6994
P990366401,"Trident Spearmint Sugar Free Gum, 14 pcs., 15 pk.",7339005045,1457,TRIDENT,4.8333
prod2380114,"ICE BREAKERS Wintergreen Sugar Free Breath Mints, 1.5 oz., 8 pk.",,1457,Ice Breakers,4.8147
prod20300340,"ICE BREAKERS Ice Cubes Spearmint Sugar Free Gum, 40 pcs., 4 pk.",3400070026,1457,Ice Breakers,4.7401
prod22182568,"Extra Spearmint Sugar-Free Gum, 35 pcs., 6 pk.",2200002075,1457,Extra,4.8581
P03005454,"Fun Sweets Summer Cotton Candy Variety Pack,  2 oz.,12 pk.",72046410032,16290835,Fun Sweets,4.5341
prod22751626,"Russell Stover Easter Bunny Solid Milk Chocolate Candy Rabbits, 2 pk.",7726006415,690107,Russell Stover ,4.744
prod22751398,"Hot Tamales, Fierce Cinnamon Candy, 54 oz.",,16290835,Hot Tamales,4.8224
119099,"Swedish Fish Soft and Chewy Candy, Mini , 2 oz., 24 pk.",7046201236,16290835,Swedish Fish,4.6912
prod4960468,"Laffy Taffy Assorted Flavors, 145 pcs.",7920079349,16290835,Laffy Taffy,4.6145
P990366402,"Trident Original Flavor Sugar Free Gum, 14 pcs., 15 pk.",7339005046,1457,TRIDENT,4.7419
P990401407,"Brach's Soft Peppermint Candies, 350 pcs.",4142008449,1457,Brach's,4.8571
110647,"ICE BREAKERS Coolmint Sugar Free Breath Mints, 1.5 oz., 8 pk.",,1457,Ice Breakers,4.8
156471,"BREATH SAVERS Wintergreen Sugar Free Breath Mints Rolls, 0.75 oz., 24 ct.",,1457,Breath Savers,4.7926
P03014519,"Ricolino Bubulubu, Mini, 50 ct.",75752804830,690107,Ricolino,4.2804
P990368824,"Member's Mark White Chocolate Cookie Crunch Bark, 20 oz.",19396846191,690107,Member's Mark,4.461
P990358713,"REESE'S Miniatures Milk Chocolate Peanut Butter Cups Candy, 56 oz.",3400044924,690107,REESE'S,4.8629
P990363550,"Ring Pop Egg Hunt Candy, Variety Pack, 50 ct. ",4111616430,16290834,Ring Pop,4.8462
P00012439,"CRUNCH Candy Bars, Full Size, 1.55 oz., 36 pk.",9990070387,690107,Nestle,4.8782
123813,"Swedish Fish Mini Soft and Chewy Candy, 3.5 lbs.",7046243160,16290835,Swedish Fish,4.7845
P990396183,"Ring Pop Red, White, And Blue Variety Pack, 32 ct.",4111606383,16290834,Ring Pop,3.0
P990366398,"Trident Fruit Sugar Free Gum Variety Pack, 14 pcs.., 20 pk.",7339005056,1457,TRIDENT,4.5385
prod22751136,"Mike and Ike Original Fruits, 54 oz.",,16290835,Mike and Ike,4.8072
P990366399,"Trident Tropical Twist Sugar Free Gum, 14 pcs., 15 pk.",,1457,TRIDENT,4.8667
P03000298,"Sweet Candy Assorted Salt Water Taffy, 4 lbs.",7144303358,16290835,Sweet Candy Company,4.4459
P990392881,"Glico Pocky Chocolate Covered Biscuit Sticks, 1.41 oz.,12 pk.",7314115512,690107,Pocky,5.0
P990392972,"REESE'S PB&J Snack Size, 39 oz.",3400045515,690107,REESE'S,4.0957
200168,"SNICKERS Milk Chocolate Candy Bars, Share Size, 3.29 oz., 24 pk.",4000032252,690107,Snickers,4.678
P990392879,"Snack Factory S'mores Pretzel Crisps, 20 Oz.",4950825270,690107,SNACK FACTORY,3.5
P990347164,"Feastables MrBeast Variety Pack Milk Chocolate Bars, 1.24 oz., 24 pk.",85005023879,690107,MR BEAST,4.4344
P990366400,"Trident Cinnamon Sugar Free Gum, 14 pieces, 15 pk.",,1457,TRIDENT,4.4286
P03014853,"WHOPPERS Robin Eggs Malted Milk Balls, Easter Candy 43 oz.",3400006799,690107,WHOPPERS,4.8267
prod8150219,"3 Musketeers Chocolate Candy Bars, Full Size, 1.92 oz., 36 pk. ",,690107,3 Musketeers,4.6331
prod21451354,"Trident Original Sugar Free Gum, 14 pcs., 15 pk.",,1457,Trident,4.7962
148972,"REESE'S Milk Chocolate Peanut Butter Cups, King Size, 2.8 oz., 24 pk.",,690107,Reese's,4.671
prod21451341,"Trident Cinnamon Sugar Free Gum, 14 pcs., 15 pk.",,1457,Trident,4.7042
P990329975,"Airheads Xtremes Bites Rainbow Berry, 2 oz., 18 pk.",,16290835,Airheads,4.2273
prod21451345,"Trident Fruit Variety Pack, Sugar Free Gum, 14 pcs., 20 pk.",,1457,Trident,4.6327
prod22182565,"Wrigley's 5 Peppermint Cobalt Gum, 35 pcs., 6 pk.",2200002078,1457,Wrigley's,4.7161
P990346525,"Paleta Payaso Chocolate Marshmallow Lollipop, 1.58 oz., 15 pk.",7432303539,16290834,RICOLINO,4.7619
P03023879,"HERSHEY'S Easter Eggs, Assorted Chocolate Flavored Candy, 190 pcs.",3400099821,690107,HERSHEY'S,4.419
131692,"Dubble Bubble Gumballs Assorted Fruit, 850 pcs. ",5964201008,1457,Dubble Bubble,4.6398
P990366403,"Trident Mint Sugar Free Gum, Variety Pack, 14 pcs., 20 pk.",7339005018,1457,TRIDENT,3.6667
prod21371373,"Ferrero Rocher Gourmet Hazelnut Chocolates, 1.3 oz., 12 pk.",980012012,690107,Ferrero Rocher,4.8118
prod1190366,"Twix Caramel Cookie Chocolate Candy Bars, Share Size, 3.02 oz., 24 pk.",4000035387,690107,Twix,4.4959
P990390954,"Skittles Gummies Original Gummy Candy, Share Size, 3 oz., 15 pk.",,16290835,Skittles,4.7391
P990390951,"Skittles Gummies Sour Gummy Candy, Share Size, 15 pk.",2200029871,16290835,SKITTLES,4.3889
prod14550107,"SOUR PUNCH Assorted Chewy Candy Twists, 180 pcs.",4136408503,16290835,Sour Punch,4.7908
P990392817,"SNICKERS Butterscotch Scoop, Fun Size, 47 pcs.",4000061055,690107,SNICKERS,4.3736
P990392894,"Chupa Chups Cremosa Lollipops, Strawberry and Choco-Vanilla, 100 ct.",,16290834,Chupa Chups,
prod740569,"Salsagheti Watermelon, 0.84 oz., 24 pk.",72518162810,16290835,Lucas,4.6575
149954,"M&M'S Peanut Milk Chocolate Candy, Share Size, 3.27 oz., 24 pk.",4000004432,690107,Mars ,4.7578
P03019742,"Wrigley's 5 Gum Spearmint Rain, 15 pcs., 10 pk.",2200010508,1457,Wrigley's,4.4894
prod22820243,"REESE'S Milk Chocolate Peanut Butter Cups, Minis, 38 oz.",3400043168,690107,Reese's,4.8293
prod21451350,"Trident Mint Variety Pack Sugar Free Gum 14 pcs., 20 pk.",1254601224,1457,Trident,4.6829
prod4640064,"El Pinatero Pinata Party Candy Mix, 5 lbs.",1880405154,16290834,Canel's,4.4235
prod11400063,"Lucas Mix Mango Chamoy, 24 ct.",72518174210,16290835,Lucas,4.4828
P990363008,"Ferrara Party Mix, 120 pcs.",7920008457,16290835,Sweetarts,4.7692
P03014521,"Ricolino Duvalin Trisabor Spread, 60 pk.",75752804831,690107,Ricolino,3.6324
P03005167,"Mamba Fruit Chews Candy, Party Size, 165 pcs. ",7279993258,16290835,Mamba,4.7772
P990403493,"HARIBO Goldbears and Wildberry Goldbears Minis, 0.4 oz., 150 ct.",4223872716,16290835,HARIBO,4.9091
P990409079,"Gem Gem Chewy Ginger Candy Variety Pack, 19oz.",,16290835,Gem Gem ,5.0
P990396135,"Copper Kettle, Pretzel Caramel Clusters, 20.3 oz.",81003270332,690107,Copper Kettle,4.2857
P990389356,"Now & Later Fruit Chews Candy, 150 pcs.",4142008466,16290835,NOW & LATER,5.0
P990391872,"Canel's Jarritos Gummies, 28.8 oz.",1880405960,16290835,Canels,4.5
P990389506,"M&M'S Peanut Butter Milk Chocolate Candy, Full Size, 24 ct.",4000001244,690107,M&M'S,4.7744
P990394864,"REESE'S PIECES Milk Chocolate Candy with Peanuts Bark, 20 oz.",3400045504,690107,REESE'S,3.3
P990392978,"KIT KAT Lemon Crisp Wafer Candy, Snack Size, 30.4oz.",3400094671,690107,KIT KAT,4.5
P990409128,"Hubba Bubba Original Bubble Gum, 18 pk.",,1457,HUBBA BUBBA,4.6
P990395416,"Airheads Mini Candy Bars, Variety Pack, 160 pcs.",7339001590,16290835,Airheads,5.0
prod21451360,"Trident Tropical Twist Sugar Free Gum, 14 pcs., 15 pk.",,1457,Trident,4.7362
prod19770113,"Now & Later Fruit Chews Candy, 150 pk.",,16290835,Now & Later,4.5847
119100,"Life Savers 5 Flavors Hard Candy, 1.14 oz., 20 pk.",,16290834,Life Savers,4.5784
P990387666,"Sour Strips Party Size XL Pack, 16.9 oz.",,16290835,Actual Candy,4.4706
prod8510249,"Life Savers Gummy Candy, Share Size, 4.2 oz., 15 pk.",,16290835,Life Savers,4.7568
P990327975,"Jimmy Dean Sausage, Egg, and Cheese Croissant Sandwiches, Frozen, 12ct.",7790000266,1483,Jimmy Dean,4.6862
165148,"Tyson Grilled Sweet Teriyaki Flavored Chicken Fillets, Frozen, 3.5 lbs.",2370004528,1515,Tyson,4.5474
prod2330992,Haagen-Dazs Vanilla Milk Chocolate Almond Ice Cream Bars 15 ct.,7457065097,1525,Häagen-Dazs,4.8416
prod13460235,"HC Fudge Bars, Frozen, 18 ct.",7265540915,1525,Healthy Choice,4.8351
P990391158,"Three Bridges Uncured Bacon Potato Bakes, 4.6 oz., 4 pk.",74275334848,1517,Three Bridges,4.16
prod22180278,"Wyler's Authentic Italian Ices, 2 oz., 96 pk.",7239294996,1525,Wyler's,4.8401
P990391627,"FatBoy Smores Sandwich Bars, 12 ct.",7786500120,1525,FatBoy Ice Cream,4.4286
P990368813,"Member's Mark Rising Crust Supreme Pizza, Frozen, 3 pk.",19396845067,1519,Member's Mark,3.6784
P03031307,"Ajinomoto Teppanyaki Vegetable Fried Rice, Frozen, 9 oz., 6 ct.",7175750883,1516,Ajinomoto,4.7305
prod9740210,"Tyson Breaded Chicken Nuggets, Frozen, 5 lbs.",2370004634,1515,Tyson,4.3828
P03029159,"Just Bare Lightly Breaded Chicken Breast Original Bites, Frozen, 3 lbs.",7701361568,1515,Just Bare,4.793
P03020469,"Member's Mark Italian Style Beef Meatballs, Frozen 6 lbs.",19396834387,1517,Member's Mark,4.6098
prod7820267,"Smucker's Uncrustables Peanut Butter and Grape Jelly Sandwiches, Frozen, 18 ct.",5150082601,1516,Smucker's,4.7943
162441,"Kellogg's Eggo Homestyle Waffles, Frozen 60 ct.",3800040240,1483,Kellogg's,4.6759
P990331024,"Member's Mark Cinnamon French Toast Sticks, Frozen, 48 oz.",19396835185,1483,Member's Mark,4.7476
P00014883,"Country Pride Breaded Chicken Breast Tenders, Frozen, 5 lbs.",7701316377,1515,Country Pride,4.4886
P03020312,Red Baron Frozen Pizza Deep Dish Singles (12 ct.),7218076174,1519,Red Baron,4.6298
197055,"Member's Mark 75/25 Seasoned Ground Beef Patties, Frozen, 1/4 lb., 40 ct.",7874210100,1515,Member's Mark,4.5356
149686,"Ore-Ida Golden Crinkles French Fries, Frozen 8 lbs.",1312008572,1517,Ore-Ida,4.7369
P03000994,"Member's Mark Boneless and Skinless Chicken Breasts, Frozen, 10 lbs.",19396814811,1515,Member's Mark,4.5197
P03004656,"Hot Pockets Pepperoni Pizza Sandwiches, Frozen, 20 ct.",4369563063,1516,Hot Pockets,4.623
prod21372050,"Member's Mark 1""x1"" Cheesecake Minis, Variety Pack, 63 ct.",7874226174,1525,Member's Mark,4.7327
prod22101497,"Member's Mark Steamable Broccoli Florets 1 lb., 4 pk.",7874221126,1521,Member's Mark,4.686
P03012465,"Just Bare Lightly Breaded Chicken Breast Original Strips, Frozen, 3 lbs.",7701361560,1515,Just Bare,4.7982
prod20071564,"Tyson Crispy Chicken Breast Strips, Frozen, 3.5 lbs.",2370004285,1515,Tyson,4.4582
prod14610047,"Member's Mark Chicken Fried Rice, Frozen, 9 oz., 6 ct.",7874215278,1516,Member's Mark,4.5204
P990326397,"Marie Callender's Chicken Pot Pies, Frozen, 8 pk.",2113137567,1516,Marie Callendar's,4.5156
P990388117,"Sublime Desserts Macarons Assorted Flavors, Frozen, 36 ct.",77507094939,1525,Sublime Desserts,4.4457
prod23222517,"Gorton’s Super Crunchy Fish Sticks, Frozen, 64 ct.",4440010490,1515,Gorton's Seafood,4.7025
P03010883,"Swaggerty's Breakfast Sausage, Frozen, 42 ct.",7602000871,1483,Swaggerty's Farm,4.8469
prod21122916,"Totino's Frozen Pizza Rolls, Pepperoni 160 ct.",4280049481,1517,Totino's,4.5753
P990326402,"Jimmy Dean Original Pancake and Sausage on a Stick, Frozen, 20 ct.",7790000270,1483,Jimmy Dean,4.7417
prod22121609,"Member's Mark Natural Sliced Strawberries, Frozen, 4 lbs.",7874228525,1521,Member's Mark,4.8034
prod20295335,"Member's Mark 80/20 Ground Angus Beef Patties, Frozen, 1/3 lb., 18 ct.",7874211341,1515,Member's Mark,4.673
163465,"FatBoy Premium Vanilla Ice Cream Sandwich, Frozen 18 ct.",7786500201,1525,FatBoy,4.8069
prod22770720,"Member's Mark Skinless and Boneless Atlantic Salmon Fillet Portions, Frozen, 2.5 lbs.",19396805983,1515,Member's Mark,4.7758
P990322580,"Jimmy Dean Fully Cooked Breakfast Pork Sausage Patties, 24 ct.",7790000249,1515,Jimmy Dean,4.7308
177468,"Nestle Drumstick Cone Variety Pack, Frozen 16 ct.",7255411096,1525,Nestle,4.71
prod21422506,"Member's Mark Farm Raised Jumbo Raw Shrimp, Frozen, 21-25 ct. per pound, 2 lbs.",19396800697,1515,Member's Mark,4.7301
P990328661,"Member's Mark Breaded Mozzarella Sticks, Frozen, 72 ct.",19396835184,1517,Member's Mark,4.4049
prod18260042,"Stouffer's Signature Lasagna with Meat Sauce, Frozen 96 oz.",1380058189,1516,Stouffer's,4.5188
prod25170409,Jimmy Dean Fully Cooked Original Pork Sausage Links 36 ct.,7790000122,1515,Jimmy Dean,4.6398
prod1180440,Jimmy Dean Fully Cooked Turkey Sausage Patties 24 ct.,7790019262,1515,Jimmy Dean,4.4761
prod22160504,"Member's Mark Mixed Vegetables  6 ct., 12 oz. bags",7874228535,1521,Member's Mark,4.7756
prod22101988,Member's Mark Broccoli Normandy 4 lbs.,7874228533,1521,Member's Mark,4.7582
prod23120260,"Member's Mark Southern Style Waffle Fries, Frozen, 4 lbs.",19396800964,1517,Member's Mark,4.5798
prod24790270,"Member's Mark Triple Berry Blend, Frozen, 64 oz.",19396807521,1521,Member's Mark,4.7325
prod22014921,"Smucker's Uncrustables Peanut Butter and Strawberry Jam Sandwiches, Frozen, 18 ct.",5150082614,1516,Smucker's,4.8504
P990323229,"Member's Mark Grilled Chicken Bites, Frozen, 3 lbs.",19396835202,1515,Member's Mark,4.3142
P03001027,"Tyson Bone-In Buffalo Style Hot Chicken Wings, Frozen, 4 lbs.",2370005648,1515,Tyson,4.3172
prod22980116,"Minh Pork Egg Rolls, Frozen 16 ct.",7218077014,1517,Minh,4.7213
P03021748,"Cole's Garlic Texas Toast, Frozen 32 ct.",7105200846,1519,Cole's,4.6315
P03000991,"Member's Mark Bone In Chicken Wings, Frozen, 10 lbs.",19396814813,1515,Member's Mark,4.5143
P03000508,"Red Baron Pepperoni Pizza with Classic Crust, Frozen 3 pk.",7218076068,1519,Red Baron,4.5449
prod18260043,"Member's Mark Mesquite Grilled Chicken Fillets, Frozen, 3 lbs.",7874211160,1515,Member's Mark,4.5951
P990333265,"Aqua Star Wild Southern King Crab Legs and Claws, Frozen, 2 lbs.",73114911621,3060101,Aqua Star,4.0361
P03017688,"Barber Foods Stuffed Cordon Bleu Chicken Breast, Frozen, 6 ct.",3160200012,1516,Barber Foods,4.6918
P03000992,"Member's Mark Boneless and Skinless Chicken Breast Tenderloins, Frozen, 6 lbs.",19396814812,1515,Member's Mark,4.6986
prod20294540,"Member's Mark 85/15 Ground Sirloin Beef Patties, Frozen, 1/3 lb., 18 ct.",7874211340,1515,Member's Mark,4.6919
P990323366,"Jimmy Dean Sweet Maple Griddle Cake Breakfast Sandwich, Frozen, 12 ct.",7790000267,1483,Jimmy Dean,4.7064
P03017711,"Gorton's Golden Crispy Panko Fish Fillets, Frozen, 28 ct.",4440010520,1515,"Gorton's, Inc.",4.6246
PL984150787,"Member's Mark Chicken Potstickers with Vegetables, 48 oz.",19396828667,1516,Member's Mark,4.5319
prod16520088,"Member's Mark Farm Raised Skinless and Boneless Tilapia Fillet Portions, Frozen, 3 lbs.",19396805068,1515,Member's Mark,4.6325
P03017346,"Member's Mark Bone-In Oven Roasted Chicken Wings, Frozen, 3 lbs.",19396832853,1515,Member's Mark,4.5857
P00000225,Snickers Ice Cream Bars 24 ct.,4767725486,1525,Snickers,4.867
prod24790290,Member's Mark Vanilla Ice Cream Pail 5 qts.,19396807757,1525,Member's Mark,4.533
P990347371,"Oreo Dairy Dessert Sandwiches, Frozen, 12 ct.",7255419193,1525,Mondelez,4.3534
P03011458,"Yummy Dino Buddies Chicken Nuggets, Frozen, 67 oz.",6456368683,1515,Yummy,4.5517
prod21001629,"Jimmy Dean Meat Lovers Breakfast Bowls, Frozen 8 ct.",7790070616,1483,Jimmy Dean,4.6547
P990395041,"Member's Mark Vegetable Potstickers, Frozen, 48 oz.",19396846585,1517,Member's Mark,4.6087
prod22761070,"Member's Mark Wild Caught Boneless Alaskan Sockeye Salmon, Frozen, 2 lbs.",19396805074,1515,Member's Mark,4.4608
P03003074,"Tru Fru White & Milk Chocolate Covered Strawberries, Frozen 18 oz.",85001211757,1525,Tru Fru,4.8052
P03014924,"Don Lee Farms Flame Grilled Angus Choice Beef Patties, Frozen, 1/4 lb., 12 ct.",8742744273,1515,Don Lee Farms,4.4449
prod24581056,"Member's Mark Natural Blueberries, Frozen 4 lbs.",19396805362,1521,Member's Mark,4.8234
108897,"ICEE Freeze Squeeze Up Variety, Frozen, 30 ct.",7332103776,1525,Icee,4.7701
prod23602834,"Member's Mark Wild Caught Skinless and Boneless Beer Battered Cod Fillets, Frozen, 11-15 ct., 2 lbs.",19396802319,1515,Member's Mark,4.4672
P03002568,"Gary's Sirloin Beef Thinly Sliced QuickSteak, Frozen, 9 ct.",81750601228,1515,Gary's QuickSteak,4.6013
171937,"Ajinomoto Vegetable Chow Mein, Frozen 9 oz., 6 pk.",7175705580,1516,Ajinomoto,4.5389
prod12430029,"White Castle Classic Cheese Sliders, Frozen, 18 ct.",8298801018,1516,White Castle,4.5293
prod4850364,"Member's Mark 9"" New York Style Cheesecake, Frozen, 12 slices",7874200681,1525,Member's Mark,4.7074
prod22821048,"Kit Kat Cones Variety Pack, Frozen, 16ct.",7255476182,1525,Kit Kat,4.6977
prod24470564,"Member's Mark Wild Caught Boneless Marinated Alaskan Salmon, Frozen, 5-7 ct., 2.25 lbs.",19396804923,1515,Member's Mark,4.1864
